item,status,value_used_now,role_in_mapping
现场工作面液压支架型号,已从现场月报提取,ZY8000/23/47D,用于由型号推读额定工作阻力，如 ZY8000 -> 8000 kN
现场工作面液压支架型号,已从现场月报提取,ZY9000/15/32D,用于由型号推读额定工作阻力，如 ZY9000 -> 9000 kN
现场支架压力,已从监测台账提取,左/右立柱及平均值，单位 MPa,作为 p_field 输入
额定液压压力 p_rated,暂用假设,40 MPa,把现场压力比例映射为额定阻力比例；需用安全阀/泵站压力校正
等效控顶面积 A_control,敏感性假设,"5.0, 6.0, 7.0 m2",把支架工作阻力转换为 FLAC3D 等效支护压力
中心距,缺失，需支架说明书/三机配套表补充,未直接使用,A_control = 中心距 × 控顶长度/有效接顶长度 的主要组成
控顶距或顶梁有效长度,缺失，需支架说明书/三机配套表补充,未直接使用,决定每架支架对应顶板面积
立柱数量、缸径、机械效率,缺失，可用于严格换算,未直接使用,可由 F = p_hydraulic * A_column_total * eta 直接计算支架力
